,claim,label,justification,claim_date,speaker,reporting_source,location_ISO_code
1466,Over 95% of people living in South Belfast own their own home.,Refuted,The answer and credible source show that the amount of people owning their own home is a lot less than 95% so the claim is refuted.,2019-12-04,Emma Little-Pengelly,Twitter,IE
1467,A study showed one in four people have had a package stolen from their residence in the U.S.,Supported,From the 2nd claim it s evident that the claim is supported ,2019-12-04,Rob Hutton,GOP weekly radio address,US
1468,Police have launched a free ride scheme in LUDHIANA where any women who is alone & not able to find vehicle to get home between 10pm-6am can call helpline numbers (1091 & 7837018555) 24×7. PCR vehicle will drop her home Free of Cost.,Supported,The answer and source show that there is a free ride scheme so the claim is supported.,2019-12-04,Harinder S Sikka,Twitter,IN
1469,Northern Ireland remains the only UK jurisdiction without funded childcare provision.,Refuted,The QandA pairs clearly show that there is help for childcare which is funded so the claim is refuted.,2019-12-04,,Ulster Unionist Party,GB
1470,Male birth control testing has been halted in India after 30 test subjects’ testicles exploded during sexual intercourse.,Refuted,The source of the claim was found to be satirical and so the claim is false.,2019-12-03,Opera News,Press,
1471,"There's a titanic battle between American nationalism and American liberal globalism. Donald Trump embodies the first camp, and half of the Americans support him on this issue, believing that the U.S. spends too much [in terms of] manpower and resources on foreign policy.",Conflicting Evidence/Cherrypicking,"The evidence is conflicting, although 69% of Americans  think that USA spends too much manpower and resources on foreign policy. There are 77% who say that NATO membership is good for the USA. The pro-NATO bill was also passed unanimously by both Republicans and democrats.",2019-12-03,Vladimir Batyuk,Russia Today,US
1472,"Defendants charged with producing, directing or promoting an obscene sexual performance by a child will be arraigned & set free.""",Not Enough Evidence,"the first Q and A set offer some insight into the claim but offers only what a law connected to the claim entails.
The other Q and A pairs offer no answer at all towards the claim and so there is not enough evidence to form a label other than 'not enough evidence.",2019-12-02,New York City Police Benevolent Association,Twitter,US
1473,Donald Trump is waging a trade war against Wisconsin farmers forcing 1600 dairy farms to close.,Supported,the loss is actually more than quoted in the claim but enough to support it ,2019-12-02,Mark Pocan,Twitter,US
1474,"Policemen distributing tasbih, prayer beads used by Muslims, and wishing Jummah Mubarak after Uddhav Thackeray was sworn in as the chief minister of Maharashtra",Not Enough Evidence,QA pairs do not state if or why policemen were giving out prayer beads used by muslims or wishing them Jummah Mubarak.,2019-12-02,प्रशान्त पटेल उमराव (@ippatel),Twitter,IN
1475,Eating bitter guard (aka gourd) or radish after eating ladyfinger can cause medical problems.,Not Enough Evidence,From the answer there is not enough information about the claim. Therefore the label is not enough evidence,2019-12-01,Krishna Pratap Singh,Facebook,IN
1476,Video shows police distributing tasbeehs as a part of Shiv Senas secularism campaign.,Refuted,"It seems that the tasbeehs were distributed due to other reason, therefore the claim is refuted",2019-12-01,MadhuPurnima Kishwar,Twitter,IN
1477,Former Ukraine President Poroshenko actively worked on behalf of US Secretary Hillary Clinton.,Supported,The Ukrainian Government under Poroshenko administration worked to aid Hillary Clinton during the 2016 presidential elections.,2019-12-01,Senator John Kennedy,"NBC, Meet the Press",US
1478,"As of December 2019 the Narendra Modi govt had enacted a new law on self-defence, to combat crimes against women in India.",Refuted,There was no such law so it is false,2019-12-01,Viral social media post,WhatsApp,IN
1479,Zip ties on windshield wipers linked to human trafficking,Refuted,No evidence to support a link between zip tied wipers and human trafficking.,2019-12-01,Mike Suddaby,Facebook,CA
1480,US governments speaker of the  House Nancy Pelosi Spent $106K of tax payer Money on a party With Hollywood Elitists,Refuted,Satire.,2019-11-30,,Daily world update,US
1481,"As mayor, Cory Booker, US Democratic presidential candidate and US New Jersey Senator,  passed criminal justice reform in a US Republican Senate.",Supported,"The bill is shown to be true and passed by the senate, as well as the mayor and majority senate claim shown to be true as shown by the Q&A pairs.",2019-11-29,United We Win,"The Other Rhodes Scholar, YouTube",US
1482,"A screenshot shows a tweet from UK Labour leader Jeremy Corbyn saying the London Bridge attacker was ""murdered by British Police”.",Refuted,Seems from the QA that the claim is actually refuted.,2019-11-29,We Love England,Facebook,GB
1483,Soros and Clinton paid women to accuse Trump of sexual attacks.,Refuted,"The evidence suggests that neither Soros nor Clinton were involved in Trump's sexual assault accusation. Nor were they donors to lawyer Lisa Bloom, who sought to arrange compensation from donors and tabloid media outlets for women who made or considered making sexual misconduct allegations against Donald Trump during the final months of the 2016 presidential race. Hence, this claim is refuted. ",2019-11-29,,The Red Pilled News,US
1484,Democratic presidential candidate and New Jersey Sen. Cory Booker was a Rhodes scholar.,Supported,The questions point directly to a database that lists Cory Booker as a Rhodes scholar. ,2019-11-29,United We Win," The Other Rhodes Scholar, YouTube",US
1485,Adam Schiff used tax dollars to settle sexual harassment lawsuit witha 19 year old man.,Refuted,There's no evidence on this lawsuit in the ethics committee of the US house of representatives which Adam Schiff is affiliated with.,2019-11-28,,Facebook,
1486,Nigeria was exposed to less than $7 billion of debt in 2015.,Refuted,Numbers do not match,2019-11-28,Obadiah Mailafia,Channels Television,NG
1487,"Mahatma Gandhi said, “You must be the change you wish to see in the world.”",Conflicting Evidence/Cherrypicking,The quote in the claim was not said by the entity the claim refers too but a similar one was spoken by that entity. with a very similar meaning according to the Q&A pairs.,2019-11-27,Inspirational Quotes and Poetry,Facebook,IN
1488,"Michelle Obama slammed First Lady Melania Trump, saying, ""She's a terrible role model for America's women.""",Refuted,The second Q&A shows that the site that featured the claim is a satirical website so the claim is refuted.,2019-11-26,,Obama Watcher,US
1489,Only 3 out of 12 regions are net contributors to the UK Treasury,Supported,"This claim is supported. According to the QA pairs, London, the South East and the East of England all had net fiscal surpluses in FY2018. This is 3 regions. Therefore, this claim is supported.",2019-11-25,,,
1490,"Raising teachers' starting salaries to £30,000 by 2022/2023 would make it among the most competitive in the graduate labour market in England.",Supported,The figures provided do show that the starting salary for teachers is closer to the 10 year mark for graduates overall. ,2019-11-24,,,GB
1491,House Speaker Nancy Pelosi approved $4.8 million in impeachment-related consulting fees to the Clinton Foundation.,Refuted,from the 2nd question and answer pair it seems that the claim is refuted,2019-11-23,Flagg Eagleton,Daily World Update,US
1492,Xavier Becerra the California Attorney General says there are now ten million illegal aliens in the state.,Refuted,The answers and sources show the amount in California is a lot less that 10 million so the claim is refuted.,2019-11-23,Mark America,Facebook,US
1493,Xavier Becerra the California Attorney General says California will receive thirteen extra seats in congress by including ten million illegal aliens in the 2020 census.,Refuted,From the 4th and 5th QA it seems as if Xavier Becerra was misquoted. Therefore the label is refuted ,2019-11-23,Mark America,Facebook,US
1494,Dominic Raab posted and then deleted a tweet describing Scotland as a region of England.,Refuted,IT was a fake tweet,2019-11-23,Mark Harper,Facebook,GB
1495,European countries aren't giving financial support to Ukraine.,Refuted,The answer refers only to countries in the European Union but clearly refutes the claim made.,2019-11-22,Donald Trump,Fox News,US
1496,Putin publicly approved Wagner’s activities numerous times.,Supported,Putin has supported their work and there is evidence of that from 2011.,2019-11-22,, Novaya Gazeta ,RU
1497,The National Committee of the USA's Democratic party gave their computer server to the Ukrainian company CrowdStrike,Refuted,Evidence was found that the company themselves CrowdStrike have commented that they never had any physical possession of the DNC servers in question by the claim so if we assume that they are telling the truth then the claim should be refuted.,2019-11-22,Donald Trump,Fox News,US
1498,CNN admitted the Entire Russian Collusion Theory Was A Hoax,Refuted,"From the Q&A it seems CNN never said what is in the claim, so it is refuted. ",2019-11-22,,thelast-news.com,US
1499,"Nigel Farage stated Nearly two-thirds of British businesses do not make a profit of over £10,000 but are subjected to corporation tax.",Refuted,"The claim begins and is phrased as ""Nigel Farage stated..."" - because of this, the question and answer pairs should therefore be structured in order to verify the authenticity of the alleged quote in the claim. The source document for question 1 lists Nigel Farage as both the leader of the Brexit Party and the first signatory to this Brexit Party ""Contract with the people"" document. The statement referring to Corporation Tax and most relevant to the claim within the document states - ""one million companies - some 66% of the total number - pay less than £10,000. This represents just 6% of Corporation Tax take in 2019; £3.4bn. Total cost £5.1bn per year."" It doesn't discuss two thirds of British businesses not making a profit of over £10,000, rather that they propose to Zero rate Corporation Tax for the first £10,000 of pre-tax profits. Also the source document in answer 1 doesn't discuss - ""fewer than half of British businesses make a profit of less than £10,000"" as referenced in answer 1.",2019-11-22,Nigel Farage ,The Telegraph,GB
1500,"Sen. Elizabeth Warren said  that her children “went to public schools,” not private ones",Conflicting Evidence/Cherrypicking,QA pairs confirm she said the quote but later amended it.,2019-11-21,,,
1501,"In US ""160 million people like their private insurance.""",Conflicting Evidence/Cherrypicking,Q and As show evidence of people being grateful and also having issues with their employer or private health insurance - cannot conclude from this that 160m people ‘like’ their private insurance.,2019-11-20,Joe Biden,Democratic Primary,US
1502,Northern Ireland has the highest femicide rate in Western Europe,Refuted,it appears that it is the second highest femicide rate in western europe,2019-11-20,Sorcha Eastwood,,GB
1503,Saving A Quarter A Day For A Year Will Get You $9100.25.,Refuted,$0.25 x 365 days = $91.25. $91.25 is less than $9100.25.,2019-11-20,,Facebook,US
1504,Former U.S. Ambassador to Ukraine Marie Yovanovitch’s net worth is as high as $23 million.,Refuted,The answer and credible source shows that the ambassador has a lot less than 23 million in assets so the claim is refuted. ,2019-11-20,,Twitter,UA
1505,"In the 266 days since we sent this bill, about 25,000 people have died from gun violence in our country, 47 percent of them teenagers or children younger than that.",Refuted,"It seems the numbers are quite a bit lower, therefore the claim is refuted ",2019-11-20,Nancy Pelosi ,,US
1506,Bay leaves eliminate the need for a pharmacy as the plant cures or alleviates everything from digestive disorders to kidney stones.,Refuted,"Q&A 1 shows whilst bay leaves are good for many ailments, they certainly do not cure everything as claimed  and may be harmful to some people with diabetes.",2019-11-20,"Eat,Drink and be merry",Facebook,US
1507,Facebook post stating that Democrats are asking why should their be a  Second Amendment.,Not Enough Evidence,There is no evidence offered that Democrats are asking why should there be a Second Amendment.,2019-11-20,Social media User,Facebook,US
1508,"13 Uber drivers were arrested for alleged sex trafficking in Atlanta, Georgia.",Refuted,"According to the sources 13   people were arrested in an undercover prostitution operation. It did not mention if they are Uber drivers and if kit was in  Atlanta, Georgia.",2019-11-20,Young Veterans Podcast,Youtube,US
1509,Muslim Body Jamiat Ulama-i-Hind have urged Congress Against Supporting Shiv Sena.,Not Enough Evidence,The answers explain the claim but do not provide any evidence for or against the claim.,2019-11-18,UNKNOWN,"TIMES NOW, ABP NEWS.",IN
1510,The U.S. Constitution sets up the  election redistricting process to be partisan.,Refuted,From the QA number 4th it does not seem being 0artisan is required. Therefore the label is ref5,2019-11-18,US State Sen. Jerry Tillman,Twitter,US
1511,"No other city in America did what (New York) did. We reduced murders by 50%, reduced police shootings to historic lows, reduced the number of people incarcerated by nearly 40% during Bloomberg's tenure",Supported,Going by the figures - there definitely seems to be around a  50% drop in murders and 40% + decrease in incarcerated people.,2019-11-17,Michael Bloomberg,,US
1512,Ron Kind is the only member of Congress that voted for inquiries into Bill Clinton and Donald Trump,Supported,The Q&A confirm that Ron Kind is the only one who voted for inquiries into Bill Clinton and Donald Trump.,2019-11-17,Rep. Ron Kind,"WISN-TV ""Up-front""",US
1513,"Under the current system, people on a work, study or family visa in the UK incur average NHS costs of £625 per year.",Supported,From the QA it seems that the number is justified. Therefore the claim is su,2019-11-17,Conservative Party,,GB
1514,"Increasing the international health surcharge in the UK to £625 and extending it to all foreign workers, including EU migrants after Brexit, will raise over £500 million a year.",Not Enough Evidence,"It seems from the last QA that there is no proof to the claim, therefore the label is not enough evidence",2019-11-17,Conservative Party,,GB
1515,Sambucol can treat the flu and make you feel better within 48 hours and almost symptom-free by 72 hours.,Not Enough Evidence,Not enough evidence from this answer to confirm or deny this claim. ,2019-11-15,Ted Hicks,Facebook,US
1516,Dwayne Johnson 'The Rock' Johnson dies at 47,Refuted,The question tackles the core of the question and has a straightforward answer. ,2019-11-15,,"Twitter, Facebook",US
1517,President Obama fired every Bush appointed ambassador upon his election.,Conflicting Evidence/Cherrypicking,"""Fired"" is a strong word to be used in this claim. ""Political ambassadors sometimes are permitted to stay on briefly during a new administration..."" are the words used in the source evidence. Therefore cherry-picking is the claim label chosen.",2019-11-15,Mark Meadows,Twitter,US
1518,"The Chinese government spent the same amount -- Rs 3,000 crore -- to construct a bridge that the Indian government spent to build the Statue of Unity in Gujarat.",Refuted,Stated that bridge cost 3.3x More than the statue.,2019-11-14,Nikhil Rampal,Twitter,IN
1519,Tirupati Balaji Temple Will Donate Rs. 100 Crores For Ram Mandir.,Refuted,The temple trust has no made any decision for donating any amount to the Ram Mandir ,2019-11-13,Social media users,Facebook,IN
1520,In 2019 there have been over fifty reports of attacks and harassment on Nigerian journalists.,Supported,From the Qa it seems that ghe claim is supported ,2019-11-13,Premium Times Centre for Investigative Journalism,Dubawa,NG
1521,Political Scientist Alexey Martynov said ‘Transnistria is an Independent State.’,Supported,The answer and source clearly show that the scientist did say the quote so the claim is supported.,2019-11-13,,,
1522,The US is  winning World Trade Organization cases for the first time.,Refuted,Q&A pair say the statement is untrue,2019-11-12,Donald Trump,,US
1523,Ivanka Trump has created 14 million jobs.,Refuted,"From the Q&As it is clear that Ivanka Trump has not created 14 million jobs, so its refuted. ",2019-11-12,Trump,,US
1524,"Every UK taxpayer  will have an additional bill of £2,400 per year under a Labour  Government.",Refuted,"The claim was made prior to the release of Labours manifesto which means theres no actual confirmed policies to base the claim on, the claim was also made by the Conservative party and comes from the Telegraph which is known for being strongly right wing and leaning towards the Conservative party, so the claim is likely biased. The claim is likely just propaganda and therefore should be refuted as it's based on no hard facts and not on the current Labour manifesto as the QA discovered.",2019-11-12,The UK Conservative Party,The Telegraph,GB
1525,"After losing 60,000 factories America is now gaining over 10,000 brand-new, beautiful factories.",Not Enough Evidence,The answer does not give me any evidence for or against the claim so there is not enough evidence.,2019-11-12,Trump,,US
1526,South African public utility Eskom generates approximately 45% of the electricity used in Africa,Refuted,Clear questions leading to a clear answer which shows the claim is exaggerated.,2019-11-12,South African state-owned electricity provider Eskom,Eksom,ZA
1527,Sri Lanka's Election Commissions announced a three-day social media ban around the country November 16 2019 election.,Refuted,"The ban has been ruled out by officials such as Election Commission Chairman Mahinda Deshapriya, and Facebook suggested that fake and malicious content which would mislead voters would be removed. The claim appears to be refuted.",2019-11-12,Nangi Baba,Facebook,LK
1528,South African public utility Eskom generates approximately 95% of the electricity used in South Africa.,Supported,"Although the two figures are for different months in 2018 and 2019 they give a result of 98%. Assuming that electricity generation is fairly stable I think the claim of ""approximately 95%"" is supported.",2019-11-12,South African state-owned electricity provider Eskom,Eksom,ZA
1529,"US manufacturing jobs have increased by over 600,000",Refuted,"the answer shows the number is not over 600,000 as claimed",2019-11-12,Trump,,US
1530,About 2% of pregnancy terminations are between 20 and 24 weeks in Great Britain in 2018.,Supported,"The Q&A pair indicates a percentage of 1.8, which is about 2%. Going by this, the claim is valid. ",2019-11-12,Naomi Long,BBC,GB
1531,Scotland’s youth unemployment rate fell by 0.3 percentage points over 2019.,Refuted,The evidence finds that the claim came from data which is not as reliable. The correct figure on Scotland's youth employment in 2019 was an increase of 0.9 percentage points.,2019-11-12,Scot Gov Economy,Twitter,GB
1532,More people are coming home from Iraq with brain cancer than any other war.,Refuted,"The 1st q7a pair state a study that was done relating to the claim, the 2nd q7a air state that the study found higher figures from another war which disputes that the war in the claim had the highest figures.",2019-11-11,Joe Biden,CNN,US
1533,Burn pits - open air waste incineration sites — are behind the purported increase in brain cancer in veterans.,Not Enough Evidence,There is not enough evidence to say whether burn pits are the reason behind the increase.,2019-11-11,Joe Biden,CNN,US
1534,The United States of America has removed Zamfara from the list of terrorist states in Nigeria,Not Enough Evidence,Zamfara seems to be on the list of 'do not travel' due to kidnapping and not due to it being a terrorist state. It is unclear if Zamfara was ever on the terrorist states list as the questions/answers do not clarify this. ,2019-11-10,Governor Bello Matawalle,,NG
1535,"In 2018, South African police service officers were accused of 217 cases of torture and 3,661 cases of assault",Supported,"The quoted source supports the claim. However, the questions are too broad, they would not lead to this source. Q1.What offences, by whom?
Q2 Needs to say torture by police &, likewise Q3 needs to say police assault.",2019-11-09,Paul T Clark,https://africasacountry.com/2019/09/its-time-to-talk-prison-abolition-in-south-africa,ZA
1536,"558 people were killed by the police in 2018, while 201 people died in police custody",Supported,The answers and credible sources show that the numbers in the claim are correct so the claim is supported.,2019-11-09,Paul T Clark,https://africasacountry.com/2019/09/its-time-to-talk-prison-abolition-in-south-africa,ZA
1537,Confederate veterans were conferred with many of the same benefits of other United States military veterans by Acts of Congress back in 1929 and 1957,Refuted,"It seems from the last QA as confederate veterans are not mentioned, in the documents, that the label is refuted",2019-11-09,Sid Miller,Facebook post,US
1538,"Since 2002, South Africa’s police force has grown by 50%",Refuted,"South Africa's police force grew by 45.3% from 2002 to 2019, not 50% as the claim suggests. Hence, the claim is refuted.",2019-11-09,Paul T Clark,https://africasacountry.com/2019/09/its-time-to-talk-prison-abolition-in-south-africa,ZA
1539,The South African Police Service kills three times more people per capita than the United States police force,Supported,"South african police kill 9 people per million people, and the US 3 per million, which is three times more people. ",2019-11-09,Paul T Clark,https://africasacountry.com/2019/09/its-time-to-talk-prison-abolition-in-south-africa,ZA
1540,Nancy Pelosi said Dems will 'shut it all down' if they don't get their way on impeachment.,Refuted,"Q&A 1 states the website the claim originated on, Q&A 2 states that the website is a satire website, so this claim is satire.",2019-11-09,Flagg Eagleton,Potatriots Unite,US
1541,South Africa remains the most unequal society in the world.,Not Enough Evidence,"Although the details for South Africa give a good explanation, there are no comparison figures for other countries. So there is nothing to compare in order to decide if South Africa has a more unequal society than other countries. ",2019-11-08,Cyril Ramaphosa,SA Govt.,ZA
1542,"Total university enrolment for university in South Africa, 1994 was around 300,000.",Refuted,"The number was closer to 500,000",2019-11-08,Cyril Ramaphosa,SA Govt.,ZA
1543,"Access to antiretroviral therapy in the South African public health sector was given to 45,500 patients in 2004.",Refuted,"The public sector was only catering to 9, 600 of them ",2019-11-08,Cyril Ramaphosa,SA Govt.,ZA
1544,The size of the South African economy over the past 25 years has doubled.,Supported,The answers and sources show that the economy has nearly doubled so the claim is supported.,2019-11-08,Cyril Ramaphosa,SA Govt.,ZA
1545,84% of all households in South Africa have electricity.,Supported,Confirmed (although slightly higher at 84.7%),2019-11-08,Cyril Ramaphosa,SA Govt.,ZA
1546,"In 2017, South Africa recorded an inflow of foreign direct investment amounting to R17 billion.",Supported,From the Q&As it seems that the figure is correct in the claim. ,2019-11-07,Cyril Ramaphosa,Address to the nation,ZA
1547,Over the past five years the South African government has invested in electrifying more than a million homes.,Supported,"The exact figures of homes in South Africa over five years, that benefited from the electricity project is even a few hundred more than a million homes. ",2019-11-07,Cyril Ramaphosa,Address to the nation,ZA
1548,"Since introducing the Safe initiative, 699 schools in SA have been provided with safe and appropriate sanitation facilities and projects and a further 1,150 schools are either in planning, design or construction stages.",Refuted,"The numbers of schools provided with with safe and appropriate sanitation facilities and those schools that are either in the planning, design or construction stages does not tally with the ones in the source. ",2019-11-07,Cyril Ramaphosa,Address to the nation,ZA
1549,Donald Trump and the Republicans have spent the past four years trying to dismantle the Affordable Care Act. They are doing everything they can — without a plan to replace it,Supported,"The answers provide ample evidence of attempts to undermine or weaken the ACA, including trying to repeal the entire law.",2019-11-07,Terrie Rizzo,Tampa Bay Times,US
1550,Over the past five years the SA government has built two new universities.,Supported,"This claim is mostly correct, 2 new universities are being built. ",2019-11-07,Cyril Ramaphosa,Addres to the nation,ZA
1551,The SA government launched the Safe initiative in August 2018.,Supported,Reliable source and easy to clarify as correct.,2019-11-07,Cyril Ramaphosa,Address to the nation,ZA
1552,Over the past five years the SA government has  invested in building hundreds of thousands of new homes.,Supported,"Using the stats supplied in the Q&A source link, this claim appears to be true.  However if the prefabricated house units as quoted were not erected, this figure may not be accurate. ",2019-11-07,Cyril Ramaphosa,Address to the nation.,ZA
