,claim,label,justification,claim_date,speaker,reporting_source,location_ISO_code
0,Hunter Biden had no experience in Ukraine or in the energy sector when he joined the board of Burisma.,Supported,No former experience stated.,2020-08-25,Pam Bondi,Speech at The Republican National Convention,US
1,Donald Trump delivered the largest tax cuts in American history.,Refuted,Three tax bills have been larger than that of Donald Trump,2020-08-25,Eric Trump,Speech at The Republican National Convention,US
2,"In Nigeria … in terms of revenue share, 20% goes to the local government.",Supported,The answer and source shows that the claim is supported as the percentage to local government is the same.,2020-08-25,Raila Odinga,YouTube,KE
3,Biden has pledged to stop border wall construction and give amnesty and health care to all illegal immigrants.,Supported,"This claim should have been split into two parts, as it is quite confusing. As for the first part, the label is supported as he did say that he would not build more of the wall. As for the 2nd part, it is more tricky, as he would allow health care access to immigrants, but it does not necessarily mean they'd get access to healthcare. Therefore, the claim is supproted",2020-08-25,Eric Trump,Speech at The Republican National Convention,US
4,"After the police shooting of Jacob Blake, Gov. Tony Evers & Lt. Gov. Mandela Barnes did not call for peace or encourage calm.",Refuted,Governor Evers did call for peace in a video statement on planned protests. ,2020-08-25,Senator Howard Marklein,Facebook,US
5,"The Common Law Admission Test (CLAT) 2020 will not be conducted on September 7, 2020, as planned",Refuted,The answer and credible source show that the claim was a hoax and so the claim is refuted.,2020-08-25,Abhijeet Verma,Social Media,IN
6,35% of revenue goes to states. (In Nigeria),Refuted,The answer shows that 26.72% goes to states so the claim is refuted.,2020-08-25,Raila Odinga,YouTube,KE
7,Margaret Sanger was a racist who believed in eugenics. Her goal when founding Planned Parenthood was to eradicate minorities.,Conflicting Evidence/Cherrypicking,"Evidence is conflicting with Margaret Sanger, as she was a progressive who believed in racial integration. She voted for Norman Thomas. She worked with progressive Black people—W.E.B. Du Bois, for example, who, along with Mary McCleod Bethune and Adam Clayton Powell Sr., served on the board of the Negro Project, a network of birth control and maternal health clinics Sanger established in Harlem and the South, etc. However, it does seem that Sanger believed in eugenics and thought people, especially poor people, often had too many kids to care for properly and that too many of those kids were born physically disabled (or, in the language of the day, ""feeble-minded""). She did not oppose forced sterilization.",2020-08-25,Abby Johnson,Speech at The Republican National Convention,US
8,"Joe Biden voted for the Irag War and supported war in Serbia, Syria and Libya.",Conflicting Evidence/Cherrypicking,The Q&A Pairs Indicate he supported 2 of the 3 conflicts.,2020-08-25,Senator Rand Paul,Speech at The Republican National Convention,US
9,Biden will take away the Second Amendment.,Refuted,Biden does not want to end second amendment,2020-08-25,Eric Trump,Speech at The Republican National Convention,US
10,Biden has pledged to defund the police,Refuted,"There is not too much information in the Q&As but from the one answer, Joe Biden refutes the claim. ",2020-08-25,Eric Trump,Speech at The Republican National Convention,US
11,45% of Nigeria's revenue goes to the federal government.,Refuted,"It seems from the 1st and 3rd QA, that a lot more goes to the federal government, therefore the claim is refuted",2020-08-25,Raila Odinga,YouTube,KE
12,Donald Trump inherited a stagnant economy and then rebuilt it.,Conflicting Evidence/Cherrypicking,QA pairs state the  US economy was downgraded and then grew under trump while another states trump inherited the longest expanding economy from obama.,2020-08-25,Larry Kudlow,Speech at The Republican National Convention,US
13,"Joe Biden voted for the Iraq War and he supported wars in Serbia, Syria, and Libya.",Supported,"Q&A's 1, 3, 5 and 6 show that Yes as claimed Joe Biden did vote for wars in Iraq, Serbia, Syria, and Libya.",2020-08-25,Sen. Rand Paul,,US
14,President Muhammadu Buhari sign a new Police bill to allow officers arrest without a warrant,Supported,The answers and sources show that the police can arrest without a warrant and therefore the claim is supported.,2020-08-24,Wanazila (@wana_),Twitter,NG
15,Plant Seeds Can Restructure Their Own DNA Through Human Saliva,Refuted,It seems from the Q&A that there is no evidence of DNA restructuring itself through saliva so the claim is refuted. ,2020-08-24,AFP,Facebook,NZ
16,We actually saw revenues to the Treasury increase after we lowered taxes in 2017. Rest assured the Democrats do not want you to know that.,Refuted,"From the evidence below, it looks like the revenue for 2017 actually fell (by 1.6 percent in real inflation-adjusted terms) when taxes were lowered in the same year. ",2020-08-24,Tim Scott,ABC,US
17,In 2019 the US Police were 20.8 times more likely to kill than be killed by a criminal,Supported,"True, FBI statistics and a national database show that checks out: In 2019, police killed 999 people, and 48 officers were killed by a criminal act in the line of duty.
We rate Larson’s claim True. ",2020-08-24,"US state Senator Chris Larson, Democrat, Milwaukee",Facebook post,US
18,"A greater proportion of 16 year olds vote in elections in Scotland, Wales and Austria than 18 and 20 year olds.",Conflicting Evidence/Cherrypicking,"Only QA 2 confirms the rate of voting was higher for 16-17 year olds in Scotland.
QA 1 says 16-17 year olds in Austria vote more than older first time voters without stating what age the ‘older’ voters are.
QA 3 implies 16-17 year olds in Wales could not vote at the time the claim was made, therefore the claim could not be true for Wales.",2020-08-24,Sophie Crozier,,NZ
19,Donald Trump has kept his promises to voters,Conflicting Evidence/Cherrypicking,QA pairs state promises kept and not kept. Claim does not state he kept all promises.,2020-08-24,,,US
20,The Edo Modular Refinery is Governor Obaseki's project.,Refuted,"The refinery, Edo Refinery and Petrochemical Limited is “fully owned and developed” by AIPCC Energy Limited.",2020-08-24,PDP Nigeria,Twitter,NG
21,There is a ‘global average’ for the number of judges and magistrates to number of people in Kenya.,Not Enough Evidence,The answers do not support or refute the claim as there is no evidence to look at in reference to the claim.,2020-08-23,David Maraga ,Youtube: NTV Kenya,KE
22,"In Kenya now with a population of about 48 million, there is one judge serving over 300,000 people.",Supported,It works out to be approximately correct,2020-08-23,David Maraga,NTV Kenya,KE
23,"Kenya had a population of about 48 million with one judge serving over 300,000 people in 2019.",Not Enough Evidence,"From the question and answer pairs, there is not enough evidence to label the claim. Therefore, it is not enough evidence.",2020-08-23,David Maraga ,Youtube: NTV Kenya,KE
24,"Anxiety levels among young teenagers dropped during the coronavirus pandemic, a study has suggested",Conflicting Evidence/Cherrypicking,"One study shows anxiety dropping amongst young teenagers, but another study shows it depends on age and whether child will be receiving exam results.",2020-08-23,,Media Outlets,
25,The Kenyan judiciary does not even get 1% of the national budget.,Supported,The answer and source show clearly that the judiciary do get less that 1% so the claim is supported.,2020-08-23,David Maraga,NTV Kenya,KE
26,"I will raise taxes for anybody making over $400,000. … No new taxes for people making less than $400,000.",Not Enough Evidence,"The claim is specific about the threshold of $400,000. There are two parts to the claim-one for people making over $400,000 and one for people making less than $400,000. The answer does not refer to the $400,000 threshold and does not specifically answer the question. Also, the answer refuses to commit anyway saying 'these numbers may change'. Further questions are required.",2020-08-23,Joe Biden,ABC News,
27,The counties are striving to reach the 10% [allocation to agriculture] recommended by the Malabo declaration.,Not Enough Evidence,No evidence to support progress or planning to achieve 10% allocation.,2020-08-23,Wycliffe Oparanya,youtube,KE
28,"Kenya only disposes of about 300,000 cases.",Supported,Confirmed According to Chief justice David Maraga ,2020-08-23,David Maraga,NTV Kenya,KE
29,"The judiciary of Kenya have an average of 400,000 cases being filed in our courts every year.",Supported,Correct,2020-08-23,David Maraga ,Youtube: NTV Kenya,KE
30,"There is an average of 400,000 cases being filed in Kenya's courts every year.",Supported,the evidence supports the claim,2020-08-23,David Maraga,NTV Kenya,KE
31,There is a ‘global average’ for the number of judges and magistrates to number of people in Kenya.,Not Enough Evidence,There is not enough evidence to show there is a global average so I can't support or refute the claim.,2020-08-23,David Maraga,NTV Kenya,KE
32,"The Kenya judiciary have one magistrate serving over 77,000 people.",Supported,"87000 is significantly different than the claimed 77,000 but since it does say ""over 77,000"" it is technically true. ",2020-08-23,David Maraga ,Youtube: NTV Kenya,KE
33,The judiciary does not even get 1% of the national Kenyan budget.,Supported,"allocated Ksh 40.5 billion to Parliament and Ksh 19.4 billion to the
Judiciary.

0.69%",2020-08-23,David Maraga ,Youtube: NTV Kenya,KE
34,All government schools in India are being privatised.,Refuted,There is no plan by the Indian government to privatize primary education as said by the Minister of Human Resource Development,2020-08-22,,,IN
35,The current Ghana administration has resulted in a decline in unemployment rates from 11.9% in 2015 to 7.3% in 2019.,Not Enough Evidence,Not enough evidence covering specified years.,2020-08-22,Nana Addo Dankwa Akufo-Addo ,,GH
36,If one gets the Spanish flu you have a 50% chance of dying,Refuted,the numbers dont match. If we take the highest figure of 40 million deaths and the infection number of 500 million,2020-08-22,Donald Trump ,,
37,"Ghana's economy previously grew at 3.4% under the form President Mahama's government and on average, for three successive years, at 7% per year with the current administration.",Supported,The GDP percentages in the answers and sources show that the claim is correct so it is supported.,2020-08-22,Nana Addo Dankwa Akufo-Addo ,,GH
38,"Kenya settles  about 300,000 court cases each year.",Supported,"The average number of settled cases is indeed around 300,000.",2020-08-22,David Maraga,NTV,KE
39,There is a ‘global average’ for the number of judges and magistrates to number of people,Not Enough Evidence,There is not enough evidence to know if this claim is correct. There is no indication that there is a 'global average' ,2020-08-22,David Maraga,NTV,KE
40,Kenya's judiciary does not even get 1% of the national budget,Supported,"Q&A 1's answer seems unrelated to the claim, but Q&A 2 does give an answer that states that the judiciary of Kenya has been receiving less than 1% of the national budget as claimed",2020-08-22,David Maraga,NTV,KE
41,"In Kenya, one Magistrate serves 77,000 people.",Refuted,"The figure in the claim is not hugely different but its enough that it cant be considered correct, so the claim is refuted. ",2020-08-22,David Maraga,NTV,KE
42,"In Kenya now, with a population of about 48 million, they have one judge serving over 300,000 people.",Supported,"In 2019, one judge serves 311,000 people in Kenya.",2020-08-22,David Maraga,NTV,KE
43,No Democrats have condemned the rioting that has occurred alongside recent protests.,Refuted,Condemned by Joe Biden Leader of the Democratic party and confirmed via source.,2020-08-21,AC Friess,Facebook,
44,"A pizza place in Washington, D.C. -- Comet Ping Pong has ties to Hillary Clinton and other leading Democrats",Refuted,No. There is not proven links at all,2020-08-21,,facebook post,US
45,South Africans that drink are amongst the top drinkers in the world.,Supported,"Is says ""amongst the top drinkers"" not the top, so since they are 6th, this could be plausible",2020-08-21,Zweli Kkhize,News24,ZA
46,South Africans are among the top drinkers in the world.,Supported,The answers and sources show that they are ranked 6th in the world so the claim is supported.,2020-08-21,Zweli Mkhize,news article,ZA
47,South African consume more alcohol per person on average than anywhere else in Africa.,Refuted,It seems that SA consumes less alcohol. Therefore the claim is refuted ,2020-08-21,Zweli Kkhize,News24,ZA
48,South Africans drink more per person than anywhere else in Africa,Refuted,The second answer and source clearly show that there are other parts of Africa where they drink more so the claim is refuted.,2020-08-21,Zweli Mkhize,News24,
49,Only 31% of South African drink alcohol,Not Enough Evidence,"Q1 is related to the claim but is too specific to either support or refute the claim.
There is a better answer to this question on the source page.
The claim was made in 2021 yet Q2 specifies 2016, which is probably the latest available data. How can there be no answer if the question switches to 2016? In fact, the source from answer 1 answers Q2.",2020-08-21,Zweli Kkhize,News24,ZA
50,South Africans drink more per person than anywhere else in Africa.,Refuted,Good clear statistics clearly show three countries appear above South Africa in the alcohol per person statistics.,2020-08-21,Zweli Mkhize,news article,ZA
51,world bank currently rates Nigeria as one of ten top performing countries on its Doing Business Index.,Supported,Nigeria is in the World Bank's top 10 Doing Business Index ,2020-08-21,Presidency Nigeria,twitter,NG
52,South Africans are among the top drinkers in the world,Supported,The answer suggests that the average consumption puts SA in the top 6 countries. ,2020-08-21,Zweli Mkhize,News24,
53,Only 31% of South Africans drink alcohol,Supported,"From the evidence, the claim that only 31% of South Africans drink alcohol is supported, seeing as 69% of South Africans over the age of 15 did not drink alcohol.",2020-08-21,Zweli Mkhize,News24,ZA
54,Only 31% of South Africans drink alcohol.,Supported,"this claims appears to be true, 69% of south africans, on a recent survey, didn't drink alcohol. ",2020-08-21,Zweli Mkhize,news article,ZA
55,Joe Biden officiated a gay wedding at the White House in 2016.,Conflicting Evidence/Cherrypicking,Q&A establish that Biden officiated and where exactly the wedding took place.,2020-08-20,Jayke Townsend,Twitter ,US
56,Democratic Arizona Superintendent of Public Instruction Kathy Hoffman is “pushing” for sex education that would teach kindergartners about masturbation and sexual positions.,Refuted,"Seems from the claim, that the senator was pushing for difference in sex education, however the measures would have been age appropriate if they had been approved. Therefore the claim is refuted",2020-08-20,Linda Traitz,Facebook,US
57,"The interface of the COVID-19 Exposure Notification System, a contact tracing programme developed by Apple and Google has been secretly inserted onto phones and tracks user’s location.",Refuted,It's clear from the Q&A that this claim is not true and has been backed up by statements.,2020-08-20,@MayGodBlessHongKong,Facebook,HK
58,Democratic Arizona Superintendent of Public Instruction Kathy Hoffman was sworn into office on a Dr. Seuss book.,Refuted,“Too Many Moose!” by Lisa Bakos not Dr Seuss,2020-08-20,Linda Traitz,Facebook,US
59,India's Supreme Court recently changed its motto from ‘Satyamev Jayate’ to ‘Yato Dharmastato Jai’.,Refuted,"This claim is refuted. According to the QA pair, there has been no evidence of the Indian Supreme Court changing its motto, as evidenced by the wiki source. Therefore, this claim is refuted.",2020-08-20,@SunilAstay,Twitter,IN
60,"Democrats recited the US Pledge of Allegiance tonight and took out ""under God"".",Refuted,Under god is included in the transcription.,2020-08-20,Kimber L Byrd,Facebook,US
61,Democratic VP candidate Kamala Harris called young voters stupid.,Supported,Confirmed in QA pair/source.,2020-08-20,ForAmerica,Facebook,US
62,Israel has developed super-quick saliva test for COVID-19.,Supported,"I think Q2 only exists because Q1 forgot to ask if it was super-quick. The answer to Q1 confirms that it is.
Q&A1 supports the claim.",2020-08-20,nikunj shah ,Twitter,IN
63,Children are silent super-spreaders of coronavirus.,Refuted,children aren't any more super-spreaders than adults. ,2020-08-20,Mark Waghorn & Shivali Best,The Daily Mirror,GB
64,Social Security checks do not go through the U.S. postal service since 2013 because it's not secure,Conflicting Evidence/Cherrypicking,"mostly this is true, as options to receive social security checks in the mail are limited to certain circumstances, instead your options are Direct Deposit or
Onto a Direct Express® Debit Mastercard",2020-08-20,,Facebook,US
65,Candace Owens was fired from her show at One America News after a  racist outburst.,Refuted,It seems that the website is for satire and is therefore nit true.the claim is thus refuted,2020-08-19,Fallis Gunnungton,Taterforce One,US
66,President Trump is the most pro-gay president in American history.,Refuted,"The Q&A pair points to some very anti gay things trump did as president, so he is unlikely to be the most pro gay president in US history.",2020-08-19,Richard Grenell,Log Cabin Republicans PAC,US
67,"US billionaires became $400 billion richer during the COVID-19 pandemic, while millions lost their $600 a week in extra unemployment.",Conflicting Evidence/Cherrypicking,"From the evidence, it looks as though 50 top billionaires lost $232 billion between the market’s peak and this Tuesday; there is no mention of them becoming richer. However, nearly 30 million workers did lose $600 in enhanced weekly unemployment benefits.",2020-08-19,Former secretary of state Hillary Clinton,2020 Democratic National Convention,US
68,"Messages in Google Earth show the ""Deep States New Home,"" which shows up on the map as ""Setatspeed Emohwen Gardens"" near Guantanamo Bay, Cuba.",Refuted,QAs provide evidence that names of the 2 ‘Deep state’ locations were searched for and no evidence found of their existence; also that a real location - Guantanamo Bay - does show up as expected on Google Earth.,2020-08-19,raydio.active,TikTok,US
69,USA is the only major industrial economy to have it unemployment rate triple.,Supported,The figures show that the rate did roughy triple and that only Canada came close. So the claim is true.,2020-08-18,Bill Clinton,2020 Democratic National Convention,
70,The USA has only 4% of the worlds population but has 25% of the worlds Covid-19 Cases.,Supported,The answers support the claim.,2020-08-18,Bill Clinton,2020 Democratic National Convention,US
71,Donald Trump is trying to take away the health care by getting rid of the Affordable Care Act.,Supported,The answers and sources show that Trump was trying to get rid of the ACA so the claim is supported.,2020-08-18,Narrator of a health care video segment,2020 Democratic National Convention,US
72,Mughal Gardens Renamed To Dr. Rajendra Prasad Garden,Refuted,"On the official Mughal gardens website, it is the same name ",2020-08-18,@smitadeshmukh,twitter,IN
73,Trumps January 2018 travel ban was unlawful.,Refuted,Q&A 2 states the actuall law that made it legal for trump to issue a travel ban (§1182(f) to suspend the entry of aliens into the United States. Pp. 9–24.) thus refuting the claim the ban was unlawful.,2020-08-18,Attorney General Sally Yates,2020 Democratic National Convention,US
74,Raising the US federally required minimum wage to $15 an hour would give 40 million workers a pay raise and push the wage scale up for everyone else.,Conflicting Evidence/Cherrypicking,"Although millions of workers would receive a pay rise - it would be an estimated A total of 39.7 million workers would benefit. Also a contradiction of ""boost the wages of
17 million workers who would otherwise earn less than $15 per hour. 
The wages of many of the 10 million workers
whose wages would be slightly above the new federal minimum would also increase"". ",2020-08-17,Sen. Bernie Sanders,C-Span,US
75,Drinking vodka protects an individual against COVID-19.,Refuted,Alcohol makes you more likely to get infected.,2020-08-17,Lorenzo “Larry” Gadon,Facebook,PH
76,BJP MP and former Union Minister Alphons Kannanthanam  sent his mother's dead body from Delhi to Kerala for the funeral without revealing she died of Covid-19.,Refuted,The Rajya Sabha MP’s mother did not die due to Covid-19,2020-08-17,AutoRaja,Twitter,IN
77,"Drinking traditional Chinese medicine (TCM) or steroids, along with antibiotics at the onset of symptoms cures COVID-19.",Refuted,Disproved by scientists..,2020-08-17,Lorenzo “Larry” Gadon,Facebook,PH
78,The Sarang Jeil Church of Jesus took preventative measure against coronavirus but the government spread the virus to prevent Rev. Jeon Kwang-hun attending the anti-government demonstration on August 15th.,Refuted,It seems from  rhe 2nd QA that no measures were taken. Therefore the claim  is refuted ,2020-08-17,Rev. Jeon Kwang-hun,YouTube,KR
79,"In 2016, 33 million Americans voted by mail.",Supported,The answer and source show that there were 33 million absentee and mail in ballots in 2016 so the claim is supported.,2020-08-17,Catherine Cortez Masto,DNC,US
80,"In Michigan, US one of the three key states that enabled Donald Trump to win the presidential election in 2016, the winning margin averaged out to just over two votes per precinct.",Supported,The fifth answer and source show that the votes per precinct is 2.23 so the claim is supported.,2020-08-17,Michelle Obama,"Transcript DNC Speech, CNN, ",US
81,The Trump administration disbanded the pandemic response team that was given to them.,Supported,"The source shows he left and was not replaced, so the claim stands up. ",2020-08-17,Eva Longoria Baston,DNC,US
82,Auto workers across Michigan could have lost their jobs if not for Barack Obama and Joe Biden,Supported,"From the 2nd QA it seems that the Obama administration indeed helped the autoworkers, therefore the claim is supported",2020-08-17,Gretchen Whitmer,DNC,US
83,Vice President Biden and President Obama assembled a pandemic playbook to make sure that America was prepared and protected.,Supported,Evidence finds that the Obama administration did prepare a document called the Playbook for Early Response to High-Consequence Emerging Infectious Disease Threats and Biological Incidents. ,2020-08-17,Eva Longoria Baston,DNC,
84,"Nigeria is the largest producer of rice in Africa, ranking 14th in the world.",Supported,Confirmed via list provided as source for question 3.,2020-08-17,Taskar Vision,,NG
85,"There are many scientific studies saying masks should be worn only in enclosed spaces, such as in elevators and conference rooms, and not outdoors",Refuted,Masks are meant to be worn in both enclosed and outdoor spaces as well as public gatherings ,2020-08-17,Lorenzo “Larry” Gadon,Facebook,PH
86,"In the US, envelopes used for mail-in ballots in general elections reveal the party affiliation of the voter allowing postal workers to toss votes.",Refuted,The envelopes do not reveal party affiliations ,2020-08-17,Justin Bonanno ,Facebook,US
87,"In one of the states that determined the outcome"" of the 2016 presidential race, ""the winning margin averaged out to just two votes per precinct — two votes.",Supported,"This claim is supported. According to the QA pair, Michelle Obama stated that the winning margin averaged out to just two votes per precinct. Therefore, this claim is supported.",2020-08-17,Michelle Obama,YouTube,US
88,A sharp decline recently in novel coronavirus cases in New York was down to Gov. Andrew M. Cuomo handling of the situation.,Conflicting Evidence/Cherrypicking,"The evidence supports the decline of coronavirus cases, but blames Gov. Andrew M Como for increasing the number of confirmed cases.",2020-08-17,Gov. Andrew M. Cuomo,2020 Democratic National Convention,US
89,President Donald Trump threatened to delay the election and suggested that he will not leave office if he loses.,Conflicting Evidence/Cherrypicking,"QA pair confirms he suggested delaying the election in a tweet dated July 30th but in another QA pair he is quoted as saying he never even thought of that and why would he want to delay the election.

It is mentioned in QA pairs he ""joked"" about staying in office longer than the maximum 2 terms but QA pairs do not make reference to him saying he wont leave if he loses the election.


",2020-08-17,Bernie Sanders,DNC,
90,Social Security beneficiaries count on the post office to get their checks,Conflicting Evidence/Cherrypicking,"Evidence contains a lot of repeated questions and answers. Regardless, Q&As reveal that some people are still paid by paper cheques; however, many people are paid by direct deposit. Hence, not everyone counts on the post office to get their checks.",2020-08-17,Eva Longoria Baston,DNC,
91,Social Security beneficiaries count on the post office to get their checks.,Supported,In 2019 and 2020 99.1% of US Social Security beneficiaries got direct deposits.,2020-08-17,Eva Longoria Bastón,2020 Democratic National Convention,US
