,claim,label,justification,claim_date,speaker,reporting_source,location_ISO_code
2290,None of the allegations made against Kenyan government ministers in 2015 made it to court.,Refuted,The Q&As provide information about the charges and court action of some of the charges against the government ministers.,2019-04-10,William Ruto,Citizen TV,KE
2291,"Kenya’s deputy president, Ruto, asked six ministers in the last term to step aside.",Supported,"there were six people who were either asked to step aside, forced to leave or who left under pressure. ",2019-04-10,William Ruto,Citizen TV,KE
2292,Kenya’s deputy president Ruto said “None of [the dropped ministers] even made it to court because the allegations that were made [against them] did not have any basis.”,Refuted,"Both of the ministers were acquitted by the ethics agency. Later on, Kamau was taken to court in April 2019. And he was charged with violating procurement laws. While Charity Ngilu was charged with obstructing commission officials from investigating the 134-acre Karen land scandal.",2019-04-10,William Ruto,Citizen TV,KE
2293,"Like every budget passed by the Senate since Dan Patrick has been lieutenant governor, Senate Bill 1 is within the spending limit set by the Texas Constitution.",Supported,confirmed with : House Bill 1 is within all of these limits from QA pair..,2019-04-09,Dan Patrick,,US
2294,Housing costs are crushing the middle class. Over 11 million Americans are spending more than half of their income on housing.,Supported,"It seems from the 2nd QA that many Americans are indeed paying half of their income on housing. Therefore, the claim is supported",2019-04-09,Kamala Harris,Twitter,US
2295,Hyderabad Police seized Rs 8 crore cash withdrawn from BJP’s bank account.,Supported,The claim as it stands is supported by the second Q&A. ,2019-04-08,Sudhir Nag,Facebook,IN
2296,"William Shakespeare wrote “I always feel happy, you know why? Because I don’t expect anything from anyone. Expectations always hurt. Life is short, so love your life, be happy. And keep smiling. Just live for yourself and before you speak, listen. Before you write, think. Before you spend, earn. Before you pray, forgive. Before you hurt, feel. Before you quit, try. Before you die, live.”",Refuted,A similar quote is attributed to William Arthur Ward ,2019-04-08,Ayo Ademokoya,Facebook,NG
2297,"Russian President Vladimir Putin has said more than once that for settling the conflict in Donbass the most important thing is not dialogue with Moscow, because Moscow is not a party to this conflict. It is an intra-Ukrainian conflict and it is up to the Ukrainians to settle it, if they talk to each other.""",Refuted,"The claim is not a quote verification but about whether Russia (Moscow) played a role in the Donbass conflict. However, Moscow always plays an important role in the Ukrainian conflict.",2019-04-08,Dmitry Peskov,,RU
2298,South Bend in Indiana unemployment fell by half under Mayor Pete Buttigieg,Not Enough Evidence,"It seems that unemployment may have fallen but it was not able to be confirmed with this Q&A, so not enough evidence is stated. ",2019-04-07,Pete Buttigieg,"NBC's ""Meet the Press""",US
2299,"The 2008 United States election was the first election in which voters of color comprised over 25 percent of the electorate, and that number is going up.",Supported,"In 2008, Records have shown that over 25 percent of the electorate comprised of voters of color. Subsequently the figures keeps getting higher. ",2019-04-07,Mac Heller,CNN,US
2300,African-American women inmates in Caifornia prisons are sterilized to cut welfare costs in California.,Refuted,"There is evidence given that African-American woman have been sterilised it also shows that asian and hispanic woman were included in the counts. This appears to be happening illegally, a law in the 1970s made it illegal to pressure anyone to be sterilised or ask for it during labor and childbirth, as evidence has been found that doctors are still operating without consent from the state then one should probably assume that if that is the case the state has not given directives for it to happen and therefore it’s untrue that the official reason would be to cut welfare costs in California.",2019-04-06,,LibertyWritersAfrica.com,US
2301,"NATO Caused the Crisis in Libya with terrorism, weapons smuggling and illegal immigration beginning after the 2011 NATO intervention.",Refuted,"NATO intervention took place 1 month after the crisis is deemed to have started based on the answers provided in the QA Pairs.

Crisis started: 15th Feb 2011.

NATO involvement: 19th March 2011.",2019-04-06,Sergey Lavrov,Russian Foreign Ministry website,RU
2302,Prime Minister Scott Morrison says an electric vehicle can't tow a boat or trailer.,Refuted,"the claim reads like a quote verification, using it to confirm if electric vehicles can't tow, this is untrue. They can tow. ",2019-04-06,Prime Minister Scott Morrison ,,AU
2303,Kenya is outperforming the average global growth,Supported,The answers show that kenya outperforms the average global growth of 3.7 percent,2019-04-05,Uhuru Kenyatta,,KE
2304,"In 2018, provisional estimates show the Kenyan economy grew by 6.1%",Supported,"In the second quater of 2018, the Kenyan economy grew by 6.2%",2019-04-05,Uhuru Kenyatta,,KE
2305,Kenya's broad-based economic growth averaged 5.6% over the last five years,Supported,factoring in a slight rounding up the numbers match.,2019-04-05,Uhuru Kenyatta,,KE
2306,US is now visa-free for Ghanaians without criminal records: stay of no more than 30 days allowed.,Refuted,From the QA it seems that Ghanaians cannot e ter the US visa-free. Therefore the claim is refuted ,2019-04-05,News@7,,GH
2307,The number of electricity connections in Kenya rose from 2.2 million in March 2013 to 7.1 million in March 2019.,Supported,The answers and sources show that the claim is correct so it is supported.,2019-04-05,Uhuru Kenyatta,,KE
2308,Joe Manchin was the only member of the Senate who has consistently voted against efforts to use the 'nuclear option' to change the rules of the Senate.,Supported,The answers and sources show that Joe Manchin was the only member who voted against consistently so the claim is supported.,2019-04-05,Joe Manchin,Twitter,US
2309,Previous claims that one or two drinks a day might protect against stroke are not true.,Supported,Increasing alcohol intake increases risk of stroke and blood pressure and does not protect against them,2019-04-05,Kelly Kelland ,Reuters,
2310,Forty percent of Americans say they don’t have enough cash to cover a $400 emergency expense.,Supported,"Looking at the figures in the official report, it seems the 40% is the correct amount of adults who say they don't have enough cash to cover a $400 emergency expense. So the claim is supported. ",2019-04-04,Kamala Harris,Facebook,US
2311,3.881 million tonnes of cargo have been transported on the standard-gauge railway line in Kenya since its inception.,Supported,"While there has been more than the stated cargo, it is close enough to be supported.",2019-04-04,,,
2312,"“Forty percent of Americans say they don’t have enough cash to cover a $400 emergency expense.""",Supported,Evidence shows that 40% of Americans could not cover $400 emergency expense without selling something or borrowing money.,2019-04-04,Kamala Harris,The Washington Post ,
2313,The number of electricity connections in Kenya rose from 2.2 million in March 2013 to 7.1 million as at March 2019.,Supported,The sources and answers support the claim. The answers though have been put the wrong way round in phase 2. The top one should be the answer for the second question and vice versa.,2019-04-04,Uhuru Kenyatta,,KE
2314,"In 2018, provisional estimates show the Kenyan economy grew by 6.1%.",Supported,Seems from the question and answer par that the economy did indeed grow by 6.1%. Therefore the claim is supported.,2019-04-04,Uhuru Kenyatta,2019 State of the Nation Address,KE
2315,Kenya’s average economic growth of 5.6% over the last five years outperformed the average global growth.,Supported,The source and answer show the average global growth and 5.6% is higher than that so the claim is supported.,2019-04-04,Uhuru Kenyatta,2019 State of the Nation Address,KE
2316,"Over 175,000 Kenyans have already registered under the voluntary scheme known as ‘boma yangu.",Supported,"The second answer and the source clearly shows that over 175,000 people have registered. The source is credible. The claim is supported.",2019-04-04,Uhuru Kenyatta,,KE
2317,Kenyatta administrations broad-based economic growth averaged 5.6% over the last five years.,Supported,the maths seems to check out and support the claim,2019-04-04,"Uhuru Kenyatta, C.G.H., President Of The Republic Of Kenya",State of the Nation address 2019,KE
2318,Since its inception 3.881 million tonnes of cargo have been transported on the standard-gauge railway line in Kenya.,Refuted,The 3rd answer and source shows that more than the claimed amount has been transported so the claim is refuted.,2019-04-04,Kenya President Uhuru Kenyatta,President Republic of Kenya,KE
2319,In 2018 provisional estimates show the Kenyan economy grew by 6.1%.,Supported,off by .1% so accepted as supported.,2019-04-04,Kenya President Uhuru Kenyatta,President Republic of Kenya,
2320,2.5 million passengers have travelled using Madaraka Express since its inception in Kenya in May 2018,Supported,"I'm assuming ""May 2018"" in the claim is an error and ""May 2017"" was intended as that's when the express first ran. 
2 million passengers by November 2018, plus about 300,000 in December and March, plus more than 116,000 (this is given as the lowest monthly count) for each of January and February is comfortably more than the claimed 2.5 million.",2019-04-04,,,
2321,As of 2019 the rate that the Kenyan economy grew at a pace that outperformed the average global growth.,Supported,Global economy growth according to the gathered evidence in the QA was at 3.7% compared to Kenya's at 5.6% so the claim appears to be supported.,2019-04-04,Kenya President Uhuru Kenyatta,President Republic of Kenya,KE
2322,"Over 175,000 Kenyans have already registered under the voluntary scheme known as boma yangu.",Supported,Wriiten properly,2019-04-04,Uhuru Kenyatta,Republic of Kenya,KE
2323,Kenya's agressive push of its universal access to basic education agenda has in 2019 seen Kenya achieve a 100% transition rate.,Refuted,Although improved it seems 100% was not achieved with the figure 93.14% being stated.,2019-04-04,Kenya President Uhuru Kenyatta,President Republic of Kenya,KE
2324,"As of April 20 2019 over 175,000 Kenyans have already registered under the voluntary scheme known as boma yangu.",Supported,"Seems that more than the given number of people have registered. Therefore, the label is supported",2019-04-04,Kenya President Uhuru Kenyatta,President Republic of Kenya,KE
2325,Kenyatta administrations aggressive push of this [universal access to basic education] agenda has this year seen us achieve 100% transition rate.,Refuted,The answer and source show that the transition rate is lower than 100% so the claim is refuted.,2019-04-04,"Uhuru Kenyatta, C.G.H., President Of The Republic Of Kenya",State of the Nation address 2019,KE
2326,In Kenya over the last six years the number of electricity connections increased from 2.2 million in March 2013 to 7.1 million as at March 2019.,Supported,2.33 million ,2019-04-04,Uhuru Kenyatta,2019 State of the Nation Address,KE
2327,"Over 175,000 Kenyans have registered under the voluntary housing allocation scheme known as boma yangu.",Supported,"As of 4 April 2019 there were 186,256 registered applicants.",2019-04-04,Uhuru Kenyatta,2019 State of the Nation Address,KE
2328,As of 2019 Kenya's broad-based economic growth averaged 5.6% over the last five years,Supported,From the 2nd QA it indeed seems that the growth averaged at 5.6%. Therefore the claim is supported ,2019-04-04,Kenya President Uhuru Kenyatta,President Republic of Kenya,KE
2329,"Since April 2013, more than KSh1.7 trillion shillings have been transferred to the Kenyan counties.",Refuted,The answer shows that the amount is less than 1.7 trillion so the claim is refuted.,2019-04-04,Uhuru Kenyatta,Republic of Kenya,KE
2330,Kenya's broad-based economic growth averaged 5.6% over the last five years as of 2019 under President Uhuru Kenyatta,Supported,"It seems from the data in the QA that the growth rate went up, therefore the claim is supported",2019-04-04,,,
2331,"The micro, small and medium enterprises sector employs approximately 14.9 million Kenyans.",Supported,From the QA it seems that the numbers are just. Therefore the claim is supported ,2019-04-04,Uhuru Kenyatta,Republic of Kenya,KE
2332,Kenyan broad-based economic growth averaged 5.6% over the last five years.,Supported,It seems that the number is correct therefore the claim is supported ,2019-04-04,Uhuru Kenyatta,Republic of Kenya,KE
2333,Since its inception 3.881 million tonnes of cargo have been transported on the standard-gauge railway line in Kenya,Refuted,The answers and sources show that 7.09 million has been transported so the claim is refuted.,2019-04-04,"Uhuru Kenyatta, C.G.H., President Of The Republic Of Kenya",State of the Nation address 2019,KE
2334,2.5 million passengers have travelled using Madaraka Express since its inception in May 2018.,Not Enough Evidence,By projection of the figures it is most probably true but there is no source to back it up,2019-04-04,Kenya President Uhuru Kenyatta,President Republic of Kenya,KE
2335,Kenya's economic growth averaged 5.6% across the five years 2013 to 2017.,Supported,"Seems that the numbers are consistent with the claim, therefore the label is supported",2019-04-04,Uhuru Kenyatta,,KE
2336,"The micro, small and medium enterprises sector employs approximately 14.9 million Kenyans.",Supported,Seems that the number is consistent with the claim therefore it is supported ,2019-04-04,Uhuru Kenyatta,,KE
2337,Kenya’s broad-based economic growth averaged 5.6% over the last five years.,Not Enough Evidence,"The evidence provided is for the year 2021; however, the claim was made on 2019-04-04. We would need to know the average of Kenya’s broad-based economic growth between the years 2013 and 2018.",2019-04-04,Uhuru Kenyatta,2019 State of the Nation address,KE
2338,Kenya's broad-based economic growth averaged 5.6% over the last five years.,Supported,It seems from the QA that the rounded up version js indeed 5.6 % therefore claim is supported ,2019-04-04,Uhuru Kenyatta,,KE
2339,2.5 million passengers have travelled using Madaraka Express since its inception in May 2017.,Supported,"It  seems that the numbers are indeed  around 2.5mln, therefore the claim is supported ",2019-04-04,"Uhuru Kenyatta, C.G.H., President Of The Republic Of Kenya",State of the Nation address 2019,KE
2340,"In 2018, provisional estimates show the Kenyan economy grew by 6.1%.",Supported,The Kenyan economy grew by and estimated 6.0% at the end of the third quatre and was still expected to keep growing into the 4th ,2019-04-04,Uhuru Kenyatta,,KE
2341,Since its inception 3.881 million tonnes of cargo have been transported on the standard-gauge railway line.,Not Enough Evidence,QA says maximum allowed but doesnt mention how much has actually been moved.,2019-04-04,Uhuru Kenyatta,,KE
2342,"The micro, small and medium enterprises sector employs approximately 14.9 million Kenyans.",Supported,Confirmed with slight rounding up.,2019-04-04,Kenya President Uhuru Kenyatta,President Republic of Kenya,KE
2343,"The micro, small and medium enterprises (MSME) sector employs approximately 14.9 million Kenyans.",Supported,This is a straight forward claim and the Question Answer pairs find a exact figure which is close enough to the approximate estimation in the claim so the claim appears to be supported.,2019-04-04,Uhuru Kenyatta,,KE
2344,Kenya's economic growth (an average of 5.6% over 2013 to 2017) outperformed the global average.,Supported,The answers clearly show that the average is higher than the global so the claim is supported.,2019-04-04,Uhuru Kenyatta,,KE
2345,"Since April 2013, more than KSh1.7 trillion shillings has been transferred to the counties of Kenya",Refuted,"This claim is incorrect.
The treasury releases KSh 1.7 trillion money to the county governments' accounts, but the controller of budget then finalises the transfer of Ksh 1,503.87 only by allowing the counties to access the money.

",2019-04-04,"Uhuru Kenyatta, C.G.H., President Of The Republic Of Kenya",State of the Nation address 2019,
2346,"The micro, small and medium enterprises sector employs approximately 14.9 million Kenyans.",Supported,"The claim figure for Kenyans employed in micro, small and medium enterprises is around 14.9 million, Q&A pair give the figure of 14.89 million employed in the micro, small and medium eEnterprise sectors. which is very close and so is supportive of the claim.",2019-04-04,"Uhuru Kenyatta, C.G.H., President Of The Republic Of Kenya",State of the Nation address 2019,KE
2347,In Kenya 2.5 million passengers have travelled using the Madaraka Express since its inception in May 2018.,Supported,"2,590,709 have travelled using the Madraka express",2019-04-04,Uhuru Kenyatta,2019 State of the Nation Address,KE
2348,Kenyatta's aggressive push of the universal access to basic education agenda has as of 2019 seen Kenya achieve 100% transition rate,Refuted,The transition rate is 93.14% rather than 100%.,2019-04-04,,,
2349,"Installed electric capacity in Kenya has increased from 1,768 MW in March 2013 to the current 2,712 MW",Not Enough Evidence,"In June 2018, Kenya's installed electricity capacity was 2351MW.",2019-04-04,,,
2350,"Over 175,000 Kenyans have already registered under the voluntary scheme known as Boma Yangu.",Supported,"186,256 is over 175,000",2019-04-04,,,
2351,"In 2018, provisional estimates show the Kenya economy grew by 6.1%.",Conflicting Evidence/Cherrypicking,The answer shows varying values of growth and none of them is specific to the value in the claim,2019-04-04,"Uhuru Kenyatta, C.G.H., President Of The Republic Of Kenya",State of the Nation address 2019,KE
2352,Kenya's aggressive push of this [universal access to basic education] agenda has this year seen us achieve 100% transition rate,Refuted,it did not reach as high as 100%,2019-04-04,Uhuru Kenyatta,,KE
2353,"In 2018, provisional estimates show the Kenyan economy grew by 6.1%.",Supported,Both the claim estimate and quoted estimate are close enough to be called supported. ,2019-04-04,,,
2354,2.5 million passengers have travelled using Madaraka Express since its inception in May 2018.,Supported,"Numbers add up to in excess of amount stated in claim. (2.5m claim vs 2,590,709.",2019-04-04,Uhuru Kenyatta,,KE
2355,Kenyan economy outperformed the average global growth the five years between 2013 and 2017.,Supported,the question-answer pair provide enough information to support the claim,2019-04-04,Uhuru Kenyatta,,KE
2356,"The micro, small and medium enterprises sector employs approximately 14.9 million Kenyans.",Supported,The second Q&A shows that the claim is correct in the numbers so the claim is supported.,2019-04-04,Uhuru Kenyatta,2019 State of the Nation Address,KE
2357,"Kenya has made tremendous gain over the last six years, with the number of electricity connections rising from 2.2 million in March 2013 to 7.1 million as at March 2019.",Supported,The Q&As match the figures in the claim so the claim is supported. The figures are slightly off but are still close enough to support.,2019-04-04,Uhuru Kenyatta,Republic of Kenya,KE
2358,"Kenya has made tremendous gains over the last 6 years, with the number of electricity connections rising from 2.2 million in March 2013 to 7.1 million as at March 2019.",Supported,"The annual reports from Kenya Power support the numbers claimed, as does the more recent statement from their spokesman.",2019-04-04,Kenya President Uhuru Kenyatta,President Republic of Kenya,KE
2359,"Over 175,000 Kenyans have already registered under the voluntary housing scheme known as ‘boma yangu.",Supported,The first Q&A show that there are over 175 thousand people who are registered so the claim is supported.,2019-04-04,Uhuru Kenyatta,,KE
2360,"Over 175,000 Kenyans have already registered under the voluntary scheme known as boma yangu.",Supported,"186,256 have registered",2019-04-04,"Uhuru Kenyatta, C.G.H., President Of The Republic Of Kenya",State of the Nation address 2019,KE
2361,"Kenyan installed electricity capacity has increased from 1,768 MW in March 2013 to the current 2,712 MW.",Not Enough Evidence,There was no question for the data on 2019 and also no answer could be found for the data on 2013 so there's no way to tell if the claim is true or false,2019-04-04,Uhuru Kenyatta,Republic of Kenya,KE
2362,2.5 million passengers have travelled using Madaraka Express between its inception in May 2017 and April 2019.,Not Enough Evidence,The latest data shown in the Q&A's is 2018 which shows the 2 millionth passenger was reconised as Rose Mbogo however the claim date is almost 6 months later so many more would have travelled on the railway but no up to date figures are shown,2019-04-04,Uhuru Kenyatta,,KE
2363,Kenya is outperforming the average global growth.,Supported,"Q&A 1 shows that the claim covers a five year period in years leading to 2019 which Q&A 6  shows an average economic growth figure of 4.36& for Kenya,
Q&A 2 shows the average global growth was only 3.04 % which is lower than Kenya as is claimed.",2019-04-04,"Uhuru Kenyatta, C.G.H., President Of The Republic Of Kenya",State of the Nation address 2019,KE
2364,The Kenyan government’s push of the universal access to basic education agenda has seen a 100% transition rate from primary to secondary school being achieved in 2019.,Refuted,The highest transition rate recorded was 94% ,2019-04-04,Uhuru Kenyatta,2019 State of the Nation Address,KE
2365,"in Kenya, installed capacity (Installed capacity is the capacity of all the power plants if they run at 100%.) has increased from 1,768 MW in March 2013 to the current 2,712 MW.",Supported,"Q&A 1 shows Kenya did have a peak demand of about 2,370 MW around the time of the claim which is close to the claimed 2.7. the Q&A also supports the claim about it being an increase form around the 1.7 mw claimed which is only .1 mw off",2019-04-04,Kenya President Uhuru Kenyatta,President Republic of Kenya,KE
2366,2.5 million passengers have travelled using Kenyan Madaraka Express since its inception in May 2018.,Supported,"Madaraka Express' three years cumulative is 699,055 in 2017  1,665,627 in 2018 and first two months of 2019 recorded 226,027 . This is  a figure slightly above 2.5 million. ",2019-04-04,Uhuru Kenyatta,Republic of Kenya,KE
2367,"Since April 2013, more than KSh1.7 trillion shillings has been transferred to the counties.",Refuted,Refuted by figures stated in QA pairs.,2019-04-04,Uhuru Kenyatta,,KE
2368,"Kenya's Installed capacity has increased from 1,768 MW in March 2013 to the current 2,712 MW",Supported,It is evidently clear that Kenya's Installed capacity keeps increasing from  March 2013. Although the Q&A Pair stopped at 2018. ,2019-04-04,"Uhuru Kenyatta, C.G.H., President Of The Republic Of Kenya",State of the Nation address 2019,KE
2369,The Kenyan economy grew 6.1% in 2018.,Refuted,the economy grew 5.65% not 6.1 so this isn't correct,2019-04-04,Uhuru Kenyatta,,KE
2370,"In 2018, provisional estimates show the Kenyan economy grew by 6.1%.",Conflicting Evidence/Cherrypicking,QA pairs vary between 5-6%,2019-04-04,Uhuru Kenyatta,Republic of Kenya,KE
2371,Since its inception 3.881 million tonnes of cargo have been transported on the standard-gauge railway line in Kenya.,Not Enough Evidence,Doesn't come to a definitive conclusion.,2019-04-04,Uhuru Kenyatta,2019 State of the Nation Address,KE
2372,Not all North Caroline teachers get a duty free lunch break.,Supported,It seems the current legislation has a goal of providing a duty free lunch break instead of guaranteeing it. ,2019-04-03,,,
2373,The UAE has banned three-month tourist visas for Nigerians,Refuted,While restrictions are being imposed there is no mention of a ban on 3 month tourist visas for Nigerians visiting UAE.,2019-04-03,Kayode Ogundamisi,Twitter,AE
2374,NATO States Sending Ukraine’s Navy ‘Junk’ Vessels,Refuted,"Some of the vessels are old, but all are modernisedd. ",2019-04-03,Andrei Koshkin,RIA Novosti,UA
2375,More than 6 lakh high-risk pregnancies identified.,Supported,"The source provided a figure of more than 7 lakh women with high risk pregnancies, therefore this confirms the claim. ",2019-04-03,"Ministry of Health & Family Welfare (MoHFW), Government of India",https://pmsma.nhp.gov.in/about-scheme/,IN
2376,More than a million Wisconsinites have voted to raise their own property taxes because Republicans have failed to fully fund our public schools for the past eight years,Not Enough Evidence,Its not clear from the Q&A if people have actually voted to raise their own taxes. So the claim does not have enough evidence. ,2019-04-03,,,
2377,80.63 lakh pregnant women immunized,Supported,True,2019-04-03,"Ministry of Health & Family Welfare (MoHFW), Government of India",https://pmsma.nhp.gov.in/about-scheme/,IN
2378,more than 50 lakh pregnant women expected to benefit every year with cash incentive of 6000 rupees,Conflicting Evidence/Cherrypicking,"!st Q&A pair state the monetary  amount in claim is about correct,  But 2nd Q&A pair say the amount of women is less than 50 lakh, not more than 50 as claimed (almost 4 thousand less!)",2019-04-03,"Ministry of Health & Family Welfare (MoHFW), Government of India",https://pmsma.nhp.gov.in/about-scheme/,IN
