,claim,label,justification,claim_date,speaker,reporting_source,location_ISO_code
725,A picture of a notice issued by Bulandshahr Police states that people have been punished for feeding migrant people have been punished for feeding migrant labourers.,Refuted,"From the 2nd QA it seems that the notice was issued to an individual due to covid, not due to feeding migrants. Therefore the label is refuted ",2020-05-14,प्रशान्ति न्यूज़ पेपर,Facebook,IN
726,India has gone through the entire three months without a single person starving.,Refuted,There is enough evidence of people not having enough to eat that the claim seems ridiculous.,2020-05-14,"Piyush Goyal, India's Union Railways Minister ",Times of India,IN
727,Hydroxychloroquine cures Covid-19.,Refuted,No conclusions have been reached on the safety and effectiveness of this medicine to treat or prevent COVID-19.,2020-05-14,Ashley Bird,Facebook ,US
728,"China issued loans to Nigeria, signed in their native tongue.",Not Enough Evidence,there doesn't seem to be enough evidence to show what the loans were signed in,2020-05-14,Ben Ibakpa,TV appearance and Twitter,NG
729,"Chinese are not taking any medicine or vaccine of coronavirus and are treating themselves at their homes with heat. They take hot steam, do hot gargles, and have hot tea four times a day each. This kills the virus in 4 days and they are free of coronavirus on 5th day.",Refuted,"From the evidence below, WHO does not recommend self-medication. There is also no evidence to suggest that hot steam or drinking hot water can prevent or kill the coronavirus. ",2020-05-13,Gurdeep Singhn Birdi,Facebook,CN
730,"Journalists in China, Singapore and the UK and US, can only operate if they obtain government-issued press passes.",Refuted,The answer and source shows that only China need the pass so the claim is refuted.,2020-05-13,,Facebook,HK
731,"Until 12 March, the government’s advice said it was ‘very unlikely’ people in care homes will become infected.",Supported,"Correct , question marks(?) missing",2020-05-13,Keir Starmer,UK Parliament - Youtube,GB
732,"Until 12 March, the government’s advice said it was ‘very unlikely’ people in care homes will become infected.",Supported,Confirmed via QA Pair and source for QA states advice removed on March 13th.,2020-05-13,Boris Johnson,UK Parliament - Youtube,GB
733,New Coronavirus antibody tests by Swiss pharmaceutical company Roche are 100% accurate.,Refuted,"This claim is refuted. According to the QA pairs, the claim is correct in stating that Roche conducted new COVID-19 antibody tests. However, with the given data, there were confliciting test results not proving 100% accuracy. For example, the manufacter reported 100% sensitvity levels mean evaluated sensitivity levels were at 83.9%. Therefore, this claim is refuted.",2020-05-13,,"The Telegraph, ITV News, Mail Online",GB
734,U.S. Rep. Alexandria Ocasio-Cortez authored a bill that would strike from the voting rolls anyone in the United States who is 65 or older.,Refuted,The source is a satirical account ,2020-05-12,,Tatersgonnatate.com,US
735,Internment camps operated by the US Federal Emergency Management Agency have been stocked with modernized guillotine devices.,Refuted, Madeea Greene is known for posting many conspiracy style stories online. ,2020-05-12,Madeea Greene,BeforeItsNews.com,US
736,HEROES Act would eliminate state requirements for voter IDs in US federal elections,Refuted,The answers and sources show that the requirements would not be fully eliminate the requirements so the claim is refuted.,2020-05-12,"Charlie Kirk, president of the conservative group Turning Point USA.",Twitter,US
737,Tourism forms 24% of Kenya's GDP.,Refuted,QA pairs state 8.2% to 10.9% far less than the amount stated in the claim even if an average is made from the numbers stated.,2020-05-12, Najib Balala. Kenya's Cabinet Secretary for Tourism and Wildlife,Twitter,KE
738,"During the 1968 flu pandemic, no businesses were ordered to close and large events such as Woodstock were still able to be held.",Supported,Nothing was forced to close so most businesses stay open ,2020-05-12,American institute for economic research,,US
739,In the first six years of life your child receives 26 substances in vaccines; some that are toxic or carcinogenic.,Refuted,The claim is refuted. There are not 26 substances in vaccines that are toxic or carcinogenic.,2020-05-12,Mia Meezy,Facebook,CA
740,"US Democratic California Sen. Dianne Feinstein once said, “All vets are mentally ill in some way and the (US)  government should prevent them from owning firearms.”",Refuted,"The question answer pairs are quite weirdly worded, therefore it is difficult to understand. However it seems that the senator did not make those statements from the lart answers. Therefore, the claim is refuted",2020-05-11,,Facebook,US
741,"Billionaire currency speculator George Soros has hailed the Covid-19 pandemic as the crisis of his lifetime, all but salivating over the chance to remake society amid the revolutionary moment he claims preceded the virus.",Refuted,"Soros does appear to make comments about the Covid-19 pandemic being a crisis of his lifetime and mentions a revolutionary moment but I feel that is taken out of context, in the answers given he doesnt seem to mention anything about salivating and wanting to remake society in the aftermath but does state our current ways of life are endangered and we dont know what the shape of capitalism will be in after.",2020-05-11,,Russia Today,RU
742,The United States is unmatched and unrivalled in its coronavirus testing capacity.,Refuted,USA Ranked 9th.,2020-05-11,Donald Trump,News Conference,US
743,House Resolution 6666 provide funds to forcibly removed people with COVID-19 from their homes,Refuted,There is no evidence in the official documents to suggest that people can be removed from their homes if they have covid-19. So this claim is refuted. ,2020-05-11,Dr. Rashid Buttar,Youtube,
744,Toni Gonzaga said she would leave the ABS-CBN network immediately if she got paid higher.,Refuted,"It seems from the 3rd QA that there is no evidence that this claim is supported, therefore the label is refuted",2020-05-11,Toni Gonzaga ,Facebook,PH
745,"100,000 people have arrived in the UK since the lockdown began in mid to late March 2020.",Supported,"From the estimates made by the Home Office over 100,000 had arrived in the UK between mid-late March 2020",2020-05-11,Keir Starmer,,GB
746,"COVID-19 Infection rates in Allegany, Cattaraugus and Chautauqua counties have consistently been among the lowest in the state.",Supported,The answer and source show that the 3 counties have been in the lowest quarter of all the counties so the claim is supported.,2020-05-11,State Sen. George Borrello,NY Senate,US
747,Pelosi's Daughters Were Arrested Breaking Into Liquor Store For 'Quarantine Supplies',Refuted,the evidence shows that the claim was made by a satirical website and the information doesn't match the facts,2020-05-11,Harry Helmet,bustatroll.org,US
748,"A Priest of Imlitala temple in Vrindavan, Uttar Pradesh, was brutally assaulted by some goons, including Bangladeshis.",Not Enough Evidence,I cannot determine if Bangladeshis were involved in the attack because the QAs do not specify the nationalities of the suspects.,2020-05-11,Bhaktivedanta Sagar Maharaja,Facebook,IN
749,Indian Council of Medical Research (ICMR) asked people to postpone travel abroad for the next two years.,Refuted,It seems that the council did not give any official guidelines. Therefore the claim is refuted,2020-05-10,IronGirl,Twitter,IN
750,House bill would “give the government the power to forcibly remove” children from their homes,Refuted,The answers and sources show that there is not a bill that would allow this so the claim is refuted.,2020-05-10,,Facebook,US
751,"Democrats are pushing for an implanted microchip in humans, and everyone to be vaccinated.",Refuted,"It seems that there is no validity to the claim based on the 2nd QA, therefore it is refuted",2020-05-10,,Facebook,US
752,Dr Devi Shetty has published a series of 22 measures needed to be taken to avoid contracting coronavirus.,Refuted,"The initial QA pair appears to refute the claim, Narayana Health says that it's not true and the audio is not Dr Shetty, the second QA asks if Dr Shetty is a expert in Coronavirus and the answer suggests that he is not.",2020-05-10,,,IN
753,A list of notable viral outbreaks between 1950 and 2019 purported to have “originated in China”,Conflicting Evidence/Cherrypicking,QA has found that notable viral outbreaks have started in both China and also other countries such as the US. Also H2N2 suggests East Asia but does not specifically say it was China.,2020-05-09,,,
754,"Ingredients in this years flu shots include mercury, antifreeze, phenol, animal blood, animal viruses and formaldehyde.",Conflicting Evidence/Cherrypicking,"Q&A 2 shows that it is Ethyl mercury that is used which is not the same thing as claimed.
Q&A 3 shows no antifreeze is in a vaccine as claimed.
Q&A 6 shows that some animal dna may be present but not animal viruses, 
Q&A 7 shows formaldehyde is used in production but not final product, and no answer is given on if blood is included as claimed so some extra evidence is needed but also some cherry picking of details is happening in the claim so overall there is mostly cherry-picking in the claim.",2020-05-09,,,US
755,"On 8th May 2020 Donald Trump tweeted ""American shops want to open! Hair needs cutting. Demokraps don’t want to bite the bullet but that’s the price we have to pay. Some oldies will have to die. We’re in God’s hands, folks! Liberate America""",Refuted,"Seems from the question-answer pair that the claim is refuted, as Donald Trump did not tweet this",2020-05-08,,Facebook,US
756,Vice President Mike Pence delivers empty boxes of PPE to a hospital as a publicity stunt,Refuted,Mike Pence did deliver ppe to the nursing home that did have supplies inside. There were boxes inside the van that were empty but they were not delivered so the claim is refuted.,2020-05-08,,,
757,COVID-19 has created the highest level of unemployment in the US since the Great Depression.,Supported,More jobs were lost during COVID-19 than the great depression ,2020-05-08,Derek Thompson,The Atlantic,US
758,"Joe Biden said voting by mail is a way to “fundamentally change this country,”.",Refuted,The 2nd q&a pair shows that Biden was not talking about postal votes so the claim is refuted.,2020-05-08,Republican National Committee,Youtube,US
759,"New York Gov. Andrew Cuomo said that “with all the technology we have, we don't need actual classrooms.”",Refuted,That isn't what was said. ,2020-05-07,Beth Parlato for Congress ,Twitter,US
760,flu vaccines make people more vulnerable to infections,Refuted,The sources and answers show that the vaccine does not make people more likely to get an infection so the claim is refuted.,2020-05-07,Anastacia Tessie Stamell Machado,Facebook,
761,The Katyn plaques were removed because the mass executions of Polish POWs 30 years ago in Russia didn't happen.,Refuted,The Soviet government admitted to the massacre and subsequent Russian leaders continue to condemn the murders.,2020-05-07,Maxim Lormushkin,YouTube,RU
762,The Canadian government included Black Rifle Coffee Company products in its recent assault-style weapons ban.,Refuted,Not mentioned on/in law.,2020-05-07,Ben Mn,Facebook,CA
763,Thrombosis is The Leading Cause Of COVID-19 Deaths,Refuted,From the 3rd question and answer it seems that thrombosis is not the leading cause of death.  Therefore the claim is refuted ,2020-05-06,,Facebook,IN
764,"A mixture of aspirin, honey, and lemon juice attacks COVID-19 and cures coronavirus.",Refuted,"Although the source link provided in the answer isn't from the official WHO website, the source information provided via a screenshot png image and uploaded to a News 'fact check' mobile website appears to make sense as a legitimate copy of official World Health Organisation guidelines that refutes the claim.
http://newsmobile.in/wp-content/uploads/2020/04/Screenshot-2020-04-15-at-12.02.19.png",2020-05-06,,Facebook,US
765,"$3 trillion for federal coronavirus stimulus packages is ""being borrowed basically from China.""",Refuted,None of the answers support this claim. ,2020-05-06,Rand Paul,Fox News,US
766,"NASCAR ELIMINATED PRE-RACE PRAYERS, MILITARY FLYOVERS AND NATIONAL ANTHEM PERFORMANCES",Refuted,"No evidence to support except that teams dont need to stand for the National Anthem, this in itself means the National Anthem is still played.",2020-05-06,Trevor Schakohl,,US
767,Cadbury Has Announced Everyone Who Shares A Link Will Receive Chocolate Hamper,Refuted,This claim is orginally from a scam website.,2020-05-06,,,
768,"The risk of death from COVID-19 is vastly less than the risk of death from driving your car home in the United States. There are about 36,000 automotive deaths per year, as compared to 36 so far this year [13 March 2020] for COVID-19.",Refuted,At the end of 2020 COVID-19 has killed over one hundred thousand people in the United States.,2020-05-06,Elon Musk,Twitter,US
769,FDA Approved Remdesivir As A Treatment For Coronavirus.,Refuted,The answers show that there are no drugs approved as a treatment for coronavirus so the claim is clearly refuted.,2020-05-05,Lita K of Cali,Facebook,US
770,Half of UK adults are now being paid by the state.,Not Enough Evidence,The answers and sources do not show enough evidence with numbers to be able to support or refute the claim.,2020-05-05,"Tom Rees  ,  Robert Mendick,  ",The Telegraph,GB
771,Congress MP Rahul Gandhi said weak upa policies were embraced by the current govt.,Refuted," In an interview with obel laureate Professor Abhijit Banerjee, Banerjee said Banerjee said the policies put in place by the UPA regime were good but are currently inadequate because they don’t cover a large section of the poor, migrants in particular. ",2020-05-05,@moneycontrolcom,twitter,IN
772,Gloves shouldn’t be worn in public because if you are wearing the same set of gloves all over town you are only spreading germs everywhere you go.,Supported,The CDC recommends only wearing gloves for tasks where the risk of infection is higher and not throughout the day.,2020-05-05,Meredith Piscitelli,Facebook,US
773,A PPE shipment was destroyed at the Port of Dover after illegal immigrants were found travelling alongside it,Refuted,No evidence of migrants stowing away on cargo ships. They seem to be crossing in smaller boats.,2020-05-05,,Facebook,GB
774,Face masks cause inadvertent harm?,Not Enough Evidence,Study for surgeons was deemed inconclusive. No other QA pairs offer evidence either way to support or refute the claim.,2020-05-05,Various,Facebook,GB
775,Billionaire philanthropist and Microsoft founder Bill Gates promotes lab grown meat.,Supported,The source mentions that Bill Gates is funding efforts to produce lab grown meat which implies promoting for it.,2020-05-04,Robb Drozdik,,
776,"The Irish Government's roadmap to ease Covid-19 restrictions will be set out in 5 phases. These phases will be on 3 week review process, the current phases would commence on the following dates:
Phase 1 - 18th May
Phase 2 - 8th June
Phase 3 - 29th June
Phase 4 - 20th July
Phase 5 - 10th August",Supported,The source shows the road map which matches the claim so it is supported.,2020-05-04,News & Memes,Facebook,IE
777,Billionaire philanthropist and Microsoft founder Bill Gates worked  specifically to end livestock production.,Not Enough Evidence,"Theres not enough evidence for the claim to be proven or unproven, whilst one answer finds that Bill Gates has back a number of star up meat alternative projects in an attempt to lower carbon footprints theres, no answer could be found on if he wants to end the livestock production altogether so theres not enough evidence presented to proove the claim is true or false.",2020-05-04,Robb Drozdik,Facebook,US
778,5G plays a part in this ‘plandemic’” The cases of COVID-19 are “directly related to electromagnetic radiation exposure by 5G,Refuted,There isn't much of a breakthrough in terms of evidence on 5G and the Pandemics connection. The evidence does explain how COVID-19 is spread - which does not connect to 5G.,2020-05-04,Dee McLachlan,Gumshoe News,
779,COVIDsafe app “hidden” rules could allow workplaces and supermarkets to bar people who haven’t installed the program on their phone.,Refuted,There are no such rules and the Australian government has made it clear that people should not be barred for not having the app,2020-05-03,Rosie Meeson,Facebook,AU
780,Aspirin combined with Honey & Lemon Juice will kill the Coronavirus,Refuted,"There are preventive measures against  Coronavirus, the cure is not yet known or found. ",2020-05-03,,Facebook,
781,Virtually no-one could have predicted that COVID-19 would spread exponentially in the U.S from February 2020 to May 2020.,Refuted,The answers and sources show that there were warnings given by officials so the claim is refuted.,2020-05-03,Larry Kudlow,"CNN ""State of the Union""",US
782,"Jack Ma said, ""2020 is not the year of thinking about your dreams or plans, but just to ensure that you stay alive""",Refuted,"Jack Ma founded Alibaba and According to Alibaba Groups Indonesia’s Director of Corporate Affairs, Dian Safitri he rubbishes the claims that Jack Ma ever delivered the message. So the claim must be refuted on the evidence that the QA pair offers.",2020-05-03,,,
783,Seating arrangement in Sudarshan 35mm cinema has been rearranged to suit physical distancing norms,Supported,Correct,2020-05-03,,New Indian Express,IN
784,"Department of telecom in India has made internet free till May 17, 2020.",Refuted,"This claim is refuted. According to the QA pair, the Department of Telecom in India has not made any type of announcement made in connection with the claim that it will make internet free till May 17th 2020. The link given in the claim metadata is also fake. The claim has also been externally fact checked as false from PIB Fact Check. Therefore, this claim is refuted.",2020-05-03,,Whatsapp,IN
785,"New York’s Andrew Cuomo and California’s Gavin Newsom, praise Trump amid the pandemic.",Conflicting Evidence/Cherrypicking,Q3 finds that these comments were taken out of context. ,2020-05-03,,Trump’s ‘American Comeback’ ad,US
786,Biden and Pelosi attacked Trump’s pandemic response.,Conflicting Evidence/Cherrypicking,"Q&A 1 says Biden did condemn Trump for hysterical xenophobia and other things in his covid response, Q&A2 shows Pelosi did attack him by tearing up a copy of his speech but this has no evidence of it being related to his covid response.
so only shows Biden attacking him which is only half the claim.",2020-05-03,,Trump’s ‘American Comeback’ ad,US
787,"Nigerian Vice President Yemi Osibanjo said ""I plead to Nigerians Don’t Retaliate Fulani Herdsmen Killings, Pray For Them Instead; just as we the Federal Executive are praying hard now.""",Refuted,The Q&As show that there is no evidence for the quote being said so the claim is refuted.,2020-05-03,Borngreat Biafara,Facebook,NG
788,The COVID-19 pandemic is a cover-up to allow for the deployment of dangerous 5G telecommunications towers.,Refuted,The answer and sources show that there are only a few countries with 5G and a lot more countries with covid cases so the claim is refuted.,2020-05-02,,Facebook,AU
789,"Retail milk prices have gone up, farmer price pay has dropped",Supported,The answers and sources show that the farmers pay has dropped and the retail prices have gone up so the claim is supported.,2020-05-02,Greg Hemsarth,Facebook,
790,"The CDC made 30,000 COVID-19 Deaths Disappear",Refuted,"Updating data is not making things ""disappear"".",2020-05-02,Zach Haller,,US
791,Covid-19 pandemic is not real,Refuted,there is plenty of evidence showing covid is real,2020-05-02,,Facebook,AU
792,"All employees of the Punjab National Bank branch at Loni in Ghaziabad, on the outskirts of Delhi, were  found to be corona positive, in May 2020.",Refuted,QA pair states only 1 employee had tested positive.,2020-05-02,Taufik Siddiki,Facebook,IN
793,"A WhatsApp text that lists 21 dos and don’ts on how to resume life after the  COVID-19 lockdown has been ascribed to Indian Council of Medical Research (ICMR), New Delhi, India.",Refuted,The (ICMR) do not have the list on their official website. ,2020-05-01,,,IN
794,U.S. Is the Only Country With Lockdown Protests.,Refuted,"Lebanon, Iraq and India among others also had protests.",2020-05-01,,Twitter,US
795,Top White House coronavirus adviser Dr. Anthony Fauci served on the Clinton Foundation’s board of directors for 20 years.,Refuted,This claim is refuted as there is no evidence that Dr Anthony Fauci was a director of the Clinton Foundation.,2020-05-01,,Facebook,US
796,Ron Johnson has changed his stance on the independence of Inspectors General when related to the President.,Supported,The answer shows that Ron did change his verdict,2020-05-01,,Press,US
797,News Report Shows Police manhandled by crowd dispersing from Mosque after Namaz.,Refuted,There was one officer that was shouted abuse at so the claim is refuted.,2020-05-01,,News18 India,IN
798,Central and state governments are paying for migrants to return to their homes.,Conflicting Evidence/Cherrypicking,QA pairs say they do pay some but not all as implied by the claim.,2020-05-01,Government Ministers,,IN
799,Men are more likely to die than women from Covid-19.,Supported,"Both Q&A pairs point out that men do die from covid more than women as claimed, this pertains to global figures on the fatality rate for men and women due to covid so fully supports the claim",2020-04-30,Taking the Biscuit@BiscuitHalf,Twitter,
800,A satire website posted a story that AOC Proposed Ending Social Security Benefits After Age 75,Supported,The claim was made by a satirical website ,2020-04-30,Christopher Blair,Bustatroll.org,US
801,"Soviet leader Nikita Khrushchev said in a speech, ""Your children's children will live under communism. You Americans are so gullible...""",Refuted,"From the 3rd QA it seems the Khrushchev never spoke those words in a speech, therefore, the claim is refuted",2020-04-30,Jack Frost,Facebook,
802,Professor Tasuku Honjo said that coronavirus is “not natural”.,Refuted,The person who supposedly made the claim has publicly refuted that they said the quote and this is on the official university website.,2020-04-29,Alan Dawber,Facebook,CN
803,Professor Tasuku Honjo worked in the Wuhan laboratory in China for four years.,Refuted,"Source for both answers shows this man's CV/work biography but I think we need to establish what ""the Wuhan laboratory"" is called.",2020-04-29,Alan Dawber,Facebook,CN
804,The CDC does not Recommend That People Who Are Healthy Wear Facemasks,Refuted,"Even if someone is healthy, it is recommended that they Wear Facemasks, says the CDC from the source. ",2020-04-29,Rick Kaiser,Facebook,US
805,"In Pennsylvania, US, if you're refused service at a store for not wearing a mask you can call the Department of Health and report the store.",Refuted,"The Department of Health, says that people should wear their masks unless there are some pre-existing medical conditions ",2020-04-28,Mark Chipchosky,Facebook,US
806,Trader Joe's are giving away a chance to get a $250 coupon.,Refuted,"The Q&A pairs state the company has dismissed this claim officially, and does also not offer coupons from their store, but does accept manufacturer coupons on its products sold in store.",2020-04-28,,Facebook,US
807,100 Indian nurses in Jhalawar resigned because Jamaatis spit at them,Refuted,From the question and answer pair it seems that the claim is refuted. ,2020-04-28,srishirajIND,twitter,IN
808,Sam's Club is giving away $250 coupons to everyone,Refuted,The answer and source show that the coupon is for 50% odd not $250 so the claim is refuted.,2020-04-28,,Facebook,US
809,The Democrats' H.R. 5717 bill would implement a 30% tax on all gun sales and a 50% tax on all ammunition sales.,Supported,"Confirmed in QA pairs one relating to weapons, the other ammunition.",2020-04-28,Andrew Watson,Facebook,US
810,The CDC has stopped reporting flu deaths because they are so low,Refuted,QA pairs confirm the data is still being published.,2020-04-28,conservative commentator and political activist Candace Owens ,Facebook,US
811,Children in the U.S. don't seem to be getting COVID-19.,Refuted,"This is false as out of one million patients in the USA, over fourty thousand were 17 years or younger",2020-04-28,Janel Brandtjen,Facebook,US
812,A virus simply does not exist.,Refuted,A virus exists and is recognised by medical science.,2020-04-27,Keith Bennett,Facebook,
813,A Facebook post defending the British government’s role in current NHS equipment shortages was written by Jennifer Saunders.,Not Enough Evidence,No evidence in the questions to support or refute. ,2020-04-27,Joey Noyce,Facebook,GB
814,New York is one of only 12 states in the USA where the average gallon of gas costs more than $2.00.,Supported,According to numbers provided by the AAA of Western and Central New York. New York is one of only 12 states where the average gallon of gas costs more than $2.00. ,2020-04-27,American Automobile Association,WKBW-TV,US
